{
  "$schema" : "http://json-schema.org/draft-04/schema",
  "x-samm-aspect-model-urn" : "urn:samm:io.catenax.single_level_scene_node:1.0.0#SingleLevelSceneNode",
  "description" : "The Single Level Scene Node for geometry Data ",
  "type" : "object",
  "components" : {
    "schemas" : {
      "UuidV4Trait" : {
        "type" : "string",
        "x-samm-aspect-model-urn" : "urn:samm:io.catenax.shared.uuid:2.0.0#UuidV4Trait",
        "description" : "The provided regular expression ensures that the UUID is composed of five groups of characters separated by hyphens, in the form 8-4-4-4-12 for a total of 36 characters (32 hexadecimal characters and 4 hyphens), optionally prefixed by \"urn:uuid:\" to make it an IRI.",
        "pattern" : "(^[0-9a-fA-F]{8}-[0-9a-fA-F]{4}-[0-9a-fA-F]{4}-[0-9a-fA-F]{4}-[0-9a-fA-F]{12}$)|(^urn:uuid:[0-9a-fA-F]{8}-[0-9a-fA-F]{4}-[0-9a-fA-F]{4}-[0-9a-fA-F]{4}-[0-9a-fA-F]{12}$)"
      },
      "SetOfSemanticTagsCharacteristic" : {
        "description" : "Set of Standardised Semantic Tags",
        "x-samm-aspect-model-urn" : "urn:samm:io.catenax.single_level_scene_node:1.0.0#SetOfSemanticTagsCharacteristic",
        "type" : "array",
        "items" : {
          "type" : "string"
        },
        "uniqueItems" : true
      },
      "SetOfCustomTagsCharacteristic" : {
        "description" : "Set of Custom Tags to define custom identifiers of geometry model type",
        "x-samm-aspect-model-urn" : "urn:samm:io.catenax.single_level_scene_node:1.0.0#SetOfCustomTagsCharacteristic",
        "type" : "array",
        "items" : {
          "type" : "string"
        },
        "uniqueItems" : true
      },
      "MatrixTrait" : {
        "description" : "Requires the matrix list to have exactly 16 elements.",
        "x-samm-aspect-model-urn" : "urn:samm:io.catenax.single_level_scene_node:1.0.0#MatrixTrait",
        "type" : "array",
        "items" : {
          "type" : "number",
          "x-samm-aspect-model-urn" : "urn:samm:io.catenax.single_level_scene_node:1.0.0#FloatCharacteristic",
          "description" : "Characteristic for a float value."
        },
        "maxItems" : 16,
        "minItems" : 16
      },
      "LocalTransformCharacteristic" : {
        "description" : "Characteristic describing the local transformation of a node.",
        "x-samm-aspect-model-urn" : "urn:samm:io.catenax.single_level_scene_node:1.0.0#LocalTransformCharacteristic",
        "type" : "object",
        "properties" : {
          "matrix4x4" : {
            "description" : "Defines a 4x4 transformation matrix for the geometry object or node.",
            "x-samm-aspect-model-urn" : "urn:samm:io.catenax.single_level_scene_node:1.0.0#matrix4x4",
            "$ref" : "#/components/schemas/MatrixTrait"
          }
        },
        "required" : [ "matrix4x4" ]
      },
      "ChildData" : {
        "description" : "Catena-X ID and meta data of the assembled child item.",
        "x-samm-aspect-model-urn" : "urn:samm:io.catenax.single_level_scene_node:1.0.0#ChildData",
        "type" : "object",
        "properties" : {
          "catenaXId" : {
            "description" : "The Catena-X ID of the given part valid for the Catena-X dataspace.",
            "x-samm-aspect-model-urn" : "urn:samm:io.catenax.single_level_scene_node:1.0.0#catenaXId",
            "$ref" : "#/components/schemas/UuidV4Trait"
          },
          "semanticTags" : {
            "description" : "Used to identify the type of the linked geometry data",
            "x-samm-aspect-model-urn" : "urn:samm:io.catenax.single_level_scene_node:1.0.0#semanticTags",
            "$ref" : "#/components/schemas/SetOfSemanticTagsCharacteristic"
          },
          "customTags" : {
            "description" : "Is used to use custom identifier of the geometry data",
            "x-samm-aspect-model-urn" : "urn:samm:io.catenax.single_level_scene_node:1.0.0#customTags",
            "$ref" : "#/components/schemas/SetOfCustomTagsCharacteristic"
          },
          "localTransform" : {
            "description" : "The local transformation (position, rotation, scale) of the node relative to its parent.",
            "x-samm-aspect-model-urn" : "urn:samm:io.catenax.single_level_scene_node:1.0.0#localTransform",
            "$ref" : "#/components/schemas/LocalTransformCharacteristic"
          }
        },
        "required" : [ "catenaXId" ]
      },
      "SetOfChildItemsCharacteristic" : {
        "description" : "Set of child items the parent item is assembled by (one structural level down).",
        "x-samm-aspect-model-urn" : "urn:samm:io.catenax.single_level_scene_node:1.0.0#SetOfChildItemsCharacteristic",
        "type" : "array",
        "items" : {
          "$ref" : "#/components/schemas/ChildData"
        },
        "uniqueItems" : true
      },
      "BoundingVolumeType" : {
        "type" : "string",
        "x-samm-aspect-model-urn" : "urn:samm:io.catenax.single_level_scene_node:1.0.0#BoundingVolumeType",
        "description" : "Defines how a bounding volume was derived: AABB (axis-aligned bounding box, relative to the node's own coordinate system) or OBB (oriented bounding box, fitted to the geometry).",
        "enum" : [ "AABB", "OBB" ]
      },
      "DiameterCharacteristic" : {
        "type" : "number",
        "x-samm-aspect-model-urn" : "urn:samm:io.catenax.single_level_scene_node:1.0.0#DiameterCharacteristic",
        "description" : "Diameter of a bounding sphere in millimetre."
      },
      "BoundingSphere" : {
        "description" : "A bounding sphere representation enclosing a geometry object or node, expressed via its diameter. Its center is the origin of its own frame (its referenceCoordinateSystem if present, otherwise the node's localTransform).",
        "x-samm-aspect-model-urn" : "urn:samm:io.catenax.single_level_scene_node:1.0.0#BoundingSphere",
        "type" : "object",
        "properties" : {
          "diameter" : {
            "description" : "Diameter of the bounding sphere, centered on the sphere's own frame (see referenceCoordinateSystem on the enclosing bounding volume).",
            "x-samm-aspect-model-urn" : "urn:samm:io.catenax.single_level_scene_node:1.0.0#diameter",
            "$ref" : "#/components/schemas/DiameterCharacteristic"
          }
        },
        "allOf" : [ {
          "$ref" : "#/components/schemas/BoundingVolumeAbstractEntity"
        } ]
      },
      "Vector3Trait" : {
        "description" : "Requires the vector to have exactly 3 elements.",
        "x-samm-aspect-model-urn" : "urn:samm:io.catenax.single_level_scene_node:1.0.0#Vector3Trait",
        "type" : "array",
        "items" : {
          "type" : "number",
          "x-samm-aspect-model-urn" : "urn:samm:io.catenax.single_level_scene_node:1.0.0#FloatCharacteristic",
          "description" : "Characteristic for a float value."
        },
        "maxItems" : 3,
        "minItems" : 3
      },
      "BoundingBoxLengthCharacteristic" : {
        "type" : "number",
        "x-samm-aspect-model-urn" : "urn:samm:io.catenax.single_level_scene_node:1.0.0#BoundingBoxLengthCharacteristic",
        "description" : "Bounding box length in millimetre."
      },
      "BoundingBoxWidthCharacteristic" : {
        "type" : "number",
        "x-samm-aspect-model-urn" : "urn:samm:io.catenax.single_level_scene_node:1.0.0#BoundingBoxWidthCharacteristic",
        "description" : "Bounding box width in millimetre."
      },
      "BoundingBoxHeightCharacteristic" : {
        "type" : "number",
        "x-samm-aspect-model-urn" : "urn:samm:io.catenax.single_level_scene_node:1.0.0#BoundingBoxHeightCharacteristic",
        "description" : "Bounding box height in millimetre."
      },
      "BoundingBox" : {
        "description" : "A bounding box representation enclosing a geometry object or node. It can be expressed via corner points, via dimensions (length, width, height), or both; all are always given in the box's own frame (its referenceCoordinateSystem if present, otherwise the node's localTransform), so they never need to account for rotation themselves.",
        "x-samm-aspect-model-urn" : "urn:samm:io.catenax.single_level_scene_node:1.0.0#BoundingBox",
        "type" : "object",
        "properties" : {
          "minPoint" : {
            "description" : "The minimum corner point of the bounding box, in the box's own frame (see boundingVolumeType and referenceCoordinateSystem on the enclosing bounding volume).",
            "x-samm-aspect-model-urn" : "urn:samm:io.catenax.single_level_scene_node:1.0.0#minPoint",
            "$ref" : "#/components/schemas/Vector3Trait"
          },
          "maxPoint" : {
            "description" : "The maximum corner point of the bounding box, in the box's own frame (see boundingVolumeType and referenceCoordinateSystem on the enclosing bounding volume).",
            "x-samm-aspect-model-urn" : "urn:samm:io.catenax.single_level_scene_node:1.0.0#maxPoint",
            "$ref" : "#/components/schemas/Vector3Trait"
          },
          "length" : {
            "description" : "Bounding box length in millimetre, along the box's own frame (see boundingVolumeType and referenceCoordinateSystem on the enclosing bounding volume) — independent of any rotation, so it can be read directly without recalculation.",
            "x-samm-aspect-model-urn" : "urn:samm:io.catenax.single_level_scene_node:1.0.0#length",
            "$ref" : "#/components/schemas/BoundingBoxLengthCharacteristic"
          },
          "width" : {
            "description" : "Bounding box width in millimetre, along the box's own frame (see boundingVolumeType and referenceCoordinateSystem on the enclosing bounding volume) — independent of any rotation, so it can be read directly without recalculation.",
            "x-samm-aspect-model-urn" : "urn:samm:io.catenax.single_level_scene_node:1.0.0#width",
            "$ref" : "#/components/schemas/BoundingBoxWidthCharacteristic"
          },
          "height" : {
            "description" : "Bounding box height in millimetre, along the box's own frame (see boundingVolumeType and referenceCoordinateSystem on the enclosing bounding volume) — independent of any rotation, so it can be read directly without recalculation.",
            "x-samm-aspect-model-urn" : "urn:samm:io.catenax.single_level_scene_node:1.0.0#height",
            "$ref" : "#/components/schemas/BoundingBoxHeightCharacteristic"
          }
        },
        "allOf" : [ {
          "$ref" : "#/components/schemas/BoundingVolumeAbstractEntity"
        } ]
      },
      "BoundingVolumeAbstractEntity" : {
        "description" : "Common properties shared by any bounding volume representation enclosing a geometry object or node, regardless of shape. If referenceCoordinateSystem is absent, the volume is expressed in the node's own localTransform frame (AABB); if present, referenceCoordinateSystem gives the volume's own origin and orientation (OBB).",
        "x-samm-aspect-model-urn" : "urn:samm:io.catenax.single_level_scene_node:1.0.0#BoundingVolumeAbstractEntity",
        "type" : "object",
        "properties" : {
          "boundingVolumeType" : {
            "description" : "Identifies how this bounding volume was derived: AABB (axis-aligned to the node's own coordinate system) or OBB (oriented, fitted to the geometry, with its own origin and orientation given by referenceCoordinateSystem).",
            "x-samm-aspect-model-urn" : "urn:samm:io.catenax.single_level_scene_node:1.0.0#boundingVolumeType",
            "$ref" : "#/components/schemas/BoundingVolumeType"
          },
          "referenceCoordinateSystem" : {
            "description" : "The coordinate system this bounding volume's own frame is placed in, when it is an OBB and therefore differs from the node's localTransform. Uses the same matrix representation as localTransform, so it can be read the same way. Absent for an AABB, where the node's localTransform applies directly.",
            "x-samm-aspect-model-urn" : "urn:samm:io.catenax.single_level_scene_node:1.0.0#referenceCoordinateSystem",
            "$ref" : "#/components/schemas/LocalTransformCharacteristic"
          }
        },
        "required" : [ "boundingVolumeType" ]
      },
      "SetOfBoundingVolumesCharacteristic" : {
        "description" : "Set of bounding volume representations describing a node (bounding boxes and/or bounding spheres), allowing more than one representation to be given at once, each disambiguated by its boundingVolumeType.",
        "x-samm-aspect-model-urn" : "urn:samm:io.catenax.single_level_scene_node:1.0.0#SetOfBoundingVolumesCharacteristic",
        "type" : "array",
        "items" : {
          "$ref" : "#/components/schemas/BoundingVolumeAbstractEntity"
        },
        "uniqueItems" : true
      },
      "ExternalBinaryModelData" : {
        "description" : "Links to io.catenax.binary_exchange",
        "x-samm-aspect-model-urn" : "urn:samm:io.catenax.single_level_scene_node:1.0.0#ExternalBinaryModelData",
        "type" : "object",
        "properties" : {
          "semanticTags" : {
            "description" : "Used to identify the type of the linked geometry data",
            "x-samm-aspect-model-urn" : "urn:samm:io.catenax.single_level_scene_node:1.0.0#semanticTags",
            "$ref" : "#/components/schemas/SetOfSemanticTagsCharacteristic"
          },
          "customTags" : {
            "description" : "Is used to use custom identifier of the geometry data",
            "x-samm-aspect-model-urn" : "urn:samm:io.catenax.single_level_scene_node:1.0.0#customTags",
            "$ref" : "#/components/schemas/SetOfCustomTagsCharacteristic"
          },
          "catenaXId" : {
            "description" : "The Catena-X ID of the given part valid for the Catena-X dataspace.",
            "x-samm-aspect-model-urn" : "urn:samm:io.catenax.single_level_scene_node:1.0.0#catenaXId",
            "$ref" : "#/components/schemas/UuidV4Trait"
          }
        },
        "required" : [ "catenaXId" ]
      },
      "SetOfModelItemsCharacteristic" : {
        "description" : "Set of geometry model items associated with a node.",
        "x-samm-aspect-model-urn" : "urn:samm:io.catenax.single_level_scene_node:1.0.0#SetOfModelItemsCharacteristic",
        "type" : "array",
        "items" : {
          "$ref" : "#/components/schemas/ExternalBinaryModelData"
        },
        "uniqueItems" : true
      }
    }
  },
  "properties" : {
    "catenaXId" : {
      "description" : "The Catena-X ID of the given part valid for the Catena-X dataspace.",
      "x-samm-aspect-model-urn" : "urn:samm:io.catenax.single_level_scene_node:1.0.0#catenaXId",
      "$ref" : "#/components/schemas/UuidV4Trait"
    },
    "childItems" : {
      "description" : "Set of child items, of which the given parent item is assembled by (one structural level down).",
      "x-samm-aspect-model-urn" : "urn:samm:io.catenax.single_level_scene_node:1.0.0#childItems",
      "$ref" : "#/components/schemas/SetOfChildItemsCharacteristic"
    },
    "localTransform" : {
      "description" : "The local transformation (position, rotation, scale) of the node relative to its parent.",
      "x-samm-aspect-model-urn" : "urn:samm:io.catenax.single_level_scene_node:1.0.0#localTransform",
      "$ref" : "#/components/schemas/LocalTransformCharacteristic"
    },
    "boundingVolumes" : {
      "description" : "The set of bounding volume representations that enclose the geometry object or node. Each entry can be a bounding box or a bounding sphere, and more than one representation can be given in parallel, e.g. one AABB and one OBB, disambiguated by each entry's boundingVolumeType.",
      "x-samm-aspect-model-urn" : "urn:samm:io.catenax.single_level_scene_node:1.0.0#boundingVolumes",
      "$ref" : "#/components/schemas/SetOfBoundingVolumesCharacteristic"
    },
    "modelItems" : {
      "description" : "The set of geometry model items associated with this node.",
      "x-samm-aspect-model-urn" : "urn:samm:io.catenax.single_level_scene_node:1.0.0#modelItems",
      "$ref" : "#/components/schemas/SetOfModelItemsCharacteristic"
    }
  },
  "required" : [ "catenaXId" ]
}