{
  "catenaXId" : "urn:uuid:055c1128-0375-47c8-98de-7cf802c3241d",
  "childItems" : [ {
    "catenaXId" : "urn:uuid:055c1128-0375-47c8-98de-7cf802c3241d",
    "semanticTags" : [ "DetailLevel_0" ],
    "customTags" : [ "Bauraum" ],
    "localTransform" : {
      "matrix4x4" : [ 0.72317415, 0.23724389, 0.99089885, 0.30157375, 0.2532931, 0.57412946, 0.60880035, 0.2588815, 0.80586946, 0.6223695, 0.87541276, 0.5492985, 0.7160485, 0.16221565, 0.071917, 0.6818127 ]
    }
  } ],
  "boundingVolumes" : [ {
    "diameter" : 315.0,
    "referenceCoordinateSystem" : {
      "matrix4x4" : [ 0.42446667, 0.93200684, 0.874391, 0.67788655, 0.5751038, 0.0018820763, 0.39649683, 0.49986368, 0.2583152, 0.9808325, 0.1527921, 0.8018058, 0.26042992, 0.7847763, 0.4616819, 0.014420986 ]
    },
    "boundingVolumeType" : "AABB"
  } ],
  "modelItems" : [ {
    "semanticTags" : [ "DetailLevel_0" ],
    "catenaXId" : "urn:uuid:055c1128-0375-47c8-98de-7cf802c3241d",
    "customTags" : [ "Bauraum" ]
  } ],
  "localTransform" : {
    "matrix4x4" : [ 0.79626095, 0.26765352, 0.57871693, 0.24259669, 0.9081256, 0.60227644, 0.14891458, 0.21662551, 0.97521985, 0.45819336, 0.065595984, 0.089025974, 0.06951785, 0.12225294, 0.090752244, 0.33811194 ]
  }
}